{
  "schemaVersion": "1.0",
  "idempotencyKey": "purupuru:correction:biore-ca-offers:2026-09-27:v1",
  "source": {
    "type": "MANUAL_CORRECTION",
    "label": "Deactivate unconfirmed Bioré 2025 Canadian offer associations",
    "url": null,
    "retrievedAt": "2026-09-27T20:08:04.687Z",
    "notes": "Post-commit correction: preserve the exact-JAN 2025 product graph and history while hiding two Canadian offers whose exact reformulation identity is not yet confirmed."
  },
  "products": [
    {
      "brand": {
        "name": "Bioré",
        "slug": "biore",
        "originMarket": "JP",
        "aliases": ["Biore", "ビオレUV"]
      },
      "family": {
        "canonicalName": "UV Aqua Rich Watery Essence",
        "slug": "biore-uv-aqua-rich-watery-essence",
        "categorySlug": "sunscreen",
        "originMarket": "JP",
        "commonEnglishAliases": ["Aqua Rich Watery Essence SPF50+ PA++++", "Biore UV Watery Essence"]
      },
      "version": {
        "versionName": "2025 Japan reformulation",
        "versionCode": "2025-JP",
        "releaseDate": "2025-02-08T00:00:00.000Z",
        "status": "CURRENT",
        "manufacturerVersionCode": null,
        "formulationFingerprint": null,
        "packagingDescription": "2025 Japan 70 g tube release with updated instant, even-film formula. Kept distinct from earlier and non-Japanese formulations.",
        "provenance": {
          "sourceUrl": "https://www.kao.com/jp/newsroom/news/release/2024/20241211-002/",
          "sourceType": "MANUFACTURER",
          "retrievedAt": "2026-09-27T19:06:42.872Z",
          "verifiedAt": "2026-09-27T19:06:42.872Z",
          "verificationStatus": "VERIFIED",
          "notes": "Existing version identity is retained unchanged; this batch changes only offer activation state."
        },
        "images": []
      },
      "variants": [
        {
          "displaySize": "70 g",
          "normalizedQuantity": 70,
          "normalizedUnit": "g",
          "gtin": "4901301447647",
          "manufacturerSku": null,
          "isDefault": true,
          "provenance": {
            "sourceUrl": "https://www.matsukiyococokara-online.com/store/catalog/product/view/id/4901301447647",
            "sourceType": "RETAILER",
            "retrievedAt": "2026-09-27T19:06:42.872Z",
            "verifiedAt": "2026-09-27T19:06:42.872Z",
            "verificationStatus": "VERIFIED",
            "notes": "Exact JAN 4901301447647 and the existing variant remain unchanged."
          },
          "images": [],
          "benchmarks": [],
          "offers": [
            {
              "retailer": {
                "sourceKey": "retailer:japanese-taste-ca",
                "name": "Japanese Taste",
                "country": "JP",
                "websiteUrl": "https://japanesetaste.ca"
              },
              "externalListingId": null,
              "listingUrl": "https://japanesetaste.ca/products/biore-uv-aqua-rich-watery-essence-sunscreen-spf50-70g",
              "isActive": false,
              "productPrice": 18.17,
              "nativeCurrency": "CAD",
              "availableMarkets": ["CA"],
              "availabilityState": "IN_STOCK",
              "observedAt": "2026-09-27T19:06:42.872Z",
              "shipping": {
                "state": "CALCULATED",
                "amount": null,
                "currency": null,
                "method": null,
                "estimate": null,
                "conditions": "Calculated at checkout for the Canadian storefront."
              },
              "items": [],
              "provenance": {
                "sourceUrl": "https://japanesetaste.ca/products/biore-uv-aqua-rich-watery-essence-sunscreen-spf50-70g",
                "sourceType": "RETAILER",
                "retrievedAt": "2026-09-27T20:08:04.687Z",
                "verifiedAt": "2026-09-27T20:08:04.687Z",
                "verificationStatus": "VERIFIED",
                "notes": "Correction targets existing offer cmuk8487e002ol004n1aph5ug. The page establishes the 70 g Canadian offer but does not expose JAN 4901301447647, so the offer is hidden pending exact-version confirmation."
              }
            },
            {
              "retailer": {
                "sourceKey": "retailer:stylevana-ca",
                "name": "STYLEVANA Canada",
                "country": "CA",
                "websiteUrl": "https://www.stylevana.com/en_CA"
              },
              "externalListingId": null,
              "listingUrl": "https://www.stylevana.com/en_CA/kao-biore-uv-aqua-rich-watery-essence-spf50-pa-70g59981.html",
              "isActive": false,
              "productPrice": 16.94,
              "nativeCurrency": "CAD",
              "availableMarkets": ["CA"],
              "availabilityState": "IN_STOCK",
              "observedAt": "2026-09-27T19:06:42.872Z",
              "shipping": {
                "state": "CALCULATED",
                "amount": null,
                "currency": null,
                "method": null,
                "estimate": null,
                "conditions": "Calculated at checkout."
              },
              "items": [],
              "provenance": {
                "sourceUrl": "https://www.stylevana.com/en_CA/kao-biore-uv-aqua-rich-watery-essence-spf50-pa-70g59981.html",
                "sourceType": "RETAILER",
                "retrievedAt": "2026-09-27T20:08:04.687Z",
                "verifiedAt": "2026-09-27T20:08:04.687Z",
                "verificationStatus": "VERIFIED",
                "notes": "Correction targets existing offer cmuk848ab002tl004w7t28jpt. The page does not expose JAN 4901301447647, so the offer is hidden pending exact-version confirmation. The retained price is identity context only and will not be written during deactivation."
              }
            }
          ]
        }
      ]
    }
  ]
}
